{
 "name": "[[153,5,9]] generalized weight-6 notched planar BB code",
 "d": 9,
 "solver": "scipy/HiGHS MILP",
 "sides": {
  "X": {
   "value": 9,
   "exact": true,
   "note": "no logical < 9 exists"
  },
  "Z": {
   "value": 9,
   "exact": true,
   "note": "no logical < 9 exists"
  }
 },
 "d_exact": true,
 "verification": {
  "level": "solver",
  "note": "backfilled: a solver verdict with no proof object, which is what every certificate carried before #2511"
 }
}
