{
  "d": 6,
  "d_exact": true,
  "name": "[[96,6,6]] 2BGA",
  "sides": {
    "X": {
      "exact": true,
      "note": "no logical < 6 exists",
      "value": 6
    },
    "Z": {
      "exact": true,
      "note": "no logical < 6 exists",
      "value": 6
    }
  },
  "solver": "scipy/HiGHS MILP",
  "verification": {
    "artifact": "certs/proofs/96-6-6.tar.gz",
    "checker": "drat-trim sha256:f58f63b0f76945d4",
    "cnf_sha256": "X=86338bf01f476d9505bc8e2361fd0813e2ebe147f1c9186142cd043ef5331050;Z=c0f50536f7bba019dd82e16629a12b8646e1bd88a0ce2bc16922623bf20a04d6",
    "level": "proof_log",
    "note": "pure-CNF re-encoding refuted by kissat 4.0.4 and checked by drat-trim; the XOR path agrees. Confirms the CNF is unsatisfiable, not that it asks the distance question"
  }
}
