{
 "name": "[[26,2,5]] 2BGA",
 "d": 5,
 "solver": "scipy/HiGHS cutoff IP",
 "sides": {
  "X": {
   "value": 5,
   "exact": true,
   "note": "no logical < 5 exists"
  },
  "Z": {
   "value": 5,
   "exact": true,
   "note": "no logical < 5 exists"
  }
 },
 "d_exact": true,
 "tlim_per_solve": 180.0,
 "verification": {
  "level": "solver",
  "note": "backfilled: a solver verdict with no proof object, which is what every certificate carried before #2511"
 }
}
