{
 "name": "[[72,14,8]] weight-8 bivariate bicycle (arXiv:2609.06572)",
 "d": 8,
 "solver": "CryptoMiniSat 5.14 SAT",
 "encoding": "selector",
 "sides": {
  "X": {
   "value": 8,
   "exact": true,
   "status": "UNSAT",
   "secs": 3.3,
   "note": "no logical < 8 exists"
  },
  "Z": {
   "value": 8,
   "exact": true,
   "status": "UNSAT",
   "secs": 4.4,
   "note": "no logical < 8 exists"
  }
 },
 "tlim_per_solve": 120,
 "symmetry": false,
 "d_exact": true,
 "verification": {
  "level": "solver",
  "note": "backfilled: a solver verdict with no proof object, which is what every certificate carried before #2511"
 }
}
