{
 "name": "[[42,14,3]] 2BGA",
 "d": 3,
 "solver": "scipy/HiGHS MILP",
 "sides": {
  "X": {
   "value": 3,
   "exact": true,
   "note": "no logical < 3 exists"
  },
  "Z": {
   "value": 3,
   "exact": true,
   "note": "no logical < 3 exists"
  }
 },
 "d_exact": true,
 "tlim_per_solve": 120,
 "verification": {
  "level": "solver",
  "note": "backfilled: a solver verdict with no proof object, which is what every certificate carried before #2511"
 }
}
