{
 "name": "[[50,2,9]], 2D-local bilayer layout",
 "d": 9,
 "solver": "CryptoMiniSat 5.14 SAT",
 "sides": {
  "X": {
   "value": 9,
   "exact": true,
   "note": "no logical < 9 exists"
  },
  "Z": {
   "value": 9,
   "exact": true,
   "note": "no logical < 9 exists"
  }
 },
 "d_exact": true,
 "verification": {
  "level": "solver",
  "note": "backfilled: a solver verdict with no proof object, which is what every certificate carried before #2511"
 }
}
