{
 "name": "[[368,8,8]] dual-grid holey rotated toric code",
 "d": 8,
 "solver": "scipy/HiGHS MILP",
 "sides": {
  "X": {
   "value": 8,
   "exact": true,
   "note": "no logical < 8 exists"
  },
  "Z": {
   "value": 8,
   "exact": true,
   "note": "no logical < 8 exists"
  }
 },
 "d_exact": true,
 "verification": {
  "level": "solver",
  "note": "backfilled: a solver verdict with no proof object, which is what every certificate carried before #2511"
 }
}
