{
  "d": 11,
  "d_exact": true,
  "encoding": "selector",
  "name": "[[121,1,11]] multi-band dense-packed code",
  "sides": {
    "X": {
      "exact": true,
      "note": "no logical < 11 exists",
      "secs": 0.0,
      "status": "UNSAT",
      "value": 11
    },
    "Z": {
      "exact": true,
      "note": "no logical < 11 exists",
      "secs": 0.2,
      "status": "UNSAT",
      "value": 11
    }
  },
  "solver": "CryptoMiniSat 5.14.7 SAT",
  "symmetry": false,
  "tlim_per_solve": 1800,
  "verification": {
    "artifact": "certs/proofs/121-1-11.tar.gz",
    "checker": "drat-trim sha256:f58f63b0f76945d4",
    "cnf_sha256": "X=686af87883645da056deb99061930feb32da639100ad6fd96a85344b3c04334d;Z=a0d9d86f03fbce290b9ed780809de2c90bdd11ac4c56230e2e4bfb6ce5ef8c2a",
    "level": "proof_log",
    "note": "pure-CNF re-encoding refuted by kissat 4.0.4 and checked by drat-trim; the XOR path agrees. Confirms the CNF is unsatisfiable, not that it asks the distance question"
  }
}
