{
 "name": "[[216,15,11]] grafted planar bivariate-bicycle (bilayer)",
 "d": 11,
 "solver": "CryptoMiniSat 5.14 SAT",
 "sides": {
  "X": {
   "value": 11,
   "exact": true,
   "note": "no logical < 11 exists (CryptoMiniSat, XOR + sequential-counter cardinality)"
  },
  "Z": {
   "value": 11,
   "exact": true,
   "note": "no logical < 11 exists (CryptoMiniSat, XOR + sequential-counter cardinality)"
  }
 },
 "d_exact": true,
 "verification": {
  "level": "solver",
  "note": "backfilled: a solver verdict with no proof object, which is what every certificate carried before #2511"
 }
}
