{
  "d": 2,
  "d_exact": true,
  "encoding": "selector",
  "name": "[[20,8,2]] 2BGA",
  "sides": {
    "X": {
      "exact": true,
      "note": "no logical < 2 exists",
      "secs": 0.0,
      "status": "UNSAT",
      "value": 2
    },
    "Z": {
      "exact": true,
      "note": "no logical < 2 exists",
      "secs": 0.0,
      "status": "UNSAT",
      "value": 2
    }
  },
  "solver": "CryptoMiniSat 5.14 SAT",
  "symmetry": false,
  "tlim_per_solve": 120,
  "verification": {
    "artifact": "certs/proofs/20-8-2.tar.gz",
    "checker": "drat-trim sha256:f58f63b0f76945d4",
    "cnf_sha256": "X=82b8abc65ab39f2cb8bd9566c6df0e7d6ab4f936dd420d7277079561b99f3456;Z=35a6459d0a4b71834e7b679ff14e485a61e0e4f9225862ad2f92fe079840bdd1",
    "level": "proof_log",
    "note": "pure-CNF re-encoding refuted by kissat 4.0.4 and checked by drat-trim; the XOR path agrees. Confirms the CNF is unsatisfiable, not that it asks the distance question"
  }
}
