{
  "d": 4,
  "d_exact": true,
  "name": "[[108,20,4]]",
  "sides": {
    "X": {
      "exact": true,
      "note": "no logical < 6 exists",
      "secs": 0.4,
      "status": "UNSAT",
      "value": 6
    },
    "Z": {
      "exact": true,
      "note": "no logical < 4 exists",
      "secs": 0.1,
      "status": "UNSAT",
      "value": 4
    }
  },
  "solver": "CryptoMiniSat 5.14.7 SAT",
  "verification": {
    "artifact": "certs/proofs/108-20-4.tar.gz",
    "checker": "drat-trim sha256:f58f63b0f76945d4",
    "cnf_sha256": "X=fc9fa6abf575347dc3963674d7bdb91ce78dda9bb61e79d7bf256fdaa036975f;Z=5f03e7fe8721162c76944b2454d7585660684d127e8fb13be269b9d2a6d814d1",
    "level": "proof_log",
    "note": "pure-CNF re-encoding refuted by kissat 4.0.4 and checked by drat-trim; the XOR path agrees. Confirms the CNF is unsatisfiable, not that it asks the distance question"
  }
}
