{
 "name": "[[88,6,6]] planar BB (paper Table I k=6 baseline)",
 "d": 6,
 "sides": {
  "X": {
   "value": 6,
   "exact": true,
   "note": "no logical < 6 exists"
  },
  "Z": {
   "value": 6,
   "exact": true,
   "note": "no logical < 6 exists"
  }
 },
 "d_exact": true,
 "solver": "scipy/HiGHS cutoff IP",
 "tlim_per_solve": 120,
 "verification": {
  "level": "solver",
  "note": "backfilled: a solver verdict with no proof object, which is what every certificate carried before #2511"
 }
}
