{
  "d": 5,
  "d_exact": true,
  "sides": {
    "X": {
      "exact": true,
      "note": "min over 1 Z-logical cosets = 5, all proven",
      "value": 5
    },
    "Z": {
      "exact": true,
      "note": "min over 1 X-logical cosets = 5, all proven",
      "value": 5
    }
  },
  "solver": "scipy/HiGHS MILP",
  "verification": {
    "artifact": "certs/proofs/25-1-5.tar.gz",
    "checker": "drat-trim sha256:f58f63b0f76945d4",
    "cnf_sha256": "X=90ca0278febf4fe87779036f6764c919391e50f1d2097ba3c364350f6076dcfb;Z=c79e76dd7c28486ba6102a82ac71649fa89a3a8324b3db898989194fe3506dc3",
    "level": "proof_log",
    "note": "pure-CNF re-encoding refuted by kissat 4.0.4 and checked by drat-trim; the XOR path agrees. Confirms the CNF is unsatisfiable, not that it asks the distance question"
  }
}
