{
 "name": "[[14,6,2]] twisted-torus BB code (arXiv:2503.03827)",
 "d": 2,
 "solver": "scipy/HiGHS MILP",
 "sides": {
  "X": {
   "value": 2,
   "exact": true,
   "note": "no logical < 2 exists"
  },
  "Z": {
   "value": 2,
   "exact": true,
   "note": "no logical < 2 exists"
  }
 },
 "d_exact": true,
 "verification": {
  "level": "solver",
  "note": "backfilled: a solver verdict with no proof object, which is what every certificate carried before #2511"
 }
}
